{
  "schemaVersion": 1,
  "sourceCorpus": "STRINGS.SOCIAL.LOG_STORY",
  "expectedLegacyCount": 304,
  "mappings": [
    {
      "legacyKey": "STRINGS.SOCIAL.LOG_STORY.ANNIVERSARY_1",
      "targetKind": "body",
      "targetId": "chronicle.anniversary.baseline.001",
      "status": "migrated",
      "legacyParityHash": "sha256:032d87763b0cc91d253d4d243e72408a18feeae723c7374114c78f4d86df5fd5",
      "targetParityHash": "sha256:aec20aad570df6bb612fb44b10b8a5b1c33e61be1de2fed420e97285dc8a9ffb",
      "parityStatus": "approved"
    },
    {
      "legacyKey": "STRINGS.SOCIAL.LOG_STORY.ANNIVERSARY_2",
      "targetKind": "body",
      "targetId": "chronicle.anniversary.baseline.002",
      "status": "migrated",
      "legacyParityHash": "sha256:5c7d26eca66ad414ffab9f4d9959a65dd481f9479e32709e88c2b104731650d4",
      "targetParityHash": "sha256:72797858b1f133a4219150de4aa20dc6a54e1776de12461d0711c0c8698ac883",
      "parityStatus": "approved"
    },
    {
      "legacyKey": "STRINGS.SOCIAL.LOG_STORY.ANNIVERSARY_3",
      "targetKind": "body",
      "targetId": "chronicle.anniversary.baseline.003",
      "status": "migrated",
      "legacyParityHash": "sha256:5d3da03bf10836452cee38f601a528a6801a9965f7d86f395bfb8929b667c424",
      "targetParityHash": "sha256:a82dc379aa0338b70c14e04b0ac49918d9a33b444803844768e652e57bab4085",
      "parityStatus": "approved"
    },
    {
      "legacyKey": "STRINGS.SOCIAL.LOG_STORY.ANNIVERSARY_4",
      "targetKind": "body",
      "targetId": "chronicle.anniversary.baseline.004",
      "status": "migrated",
      "legacyParityHash": "sha256:c0b8a9dc8ef3bda97adce41414878c8655e052b874d837b82fb432b6ec9de98b",
      "targetParityHash": "sha256:4037fe2c36c8a08cc3eeb8886cfbd55af928c7017322a5c4ed926e534922839a",
      "parityStatus": "approved"
    },
    {
      "legacyKey": "STRINGS.SOCIAL.LOG_STORY.ANNIVERSARY_MISSED_1",
      "targetKind": "body",
      "targetId": "chronicle.anniversary-missed.baseline.001",
      "status": "migrated",
      "legacyParityHash": "sha256:bda5dcd9d5150d4cc445ca569ec8fbe9d7931951a01bd3034d34958364b8cff6",
      "targetParityHash": "sha256:c241bbf1cbae2945ce4d81ce12a9f708dda737cd745f43ccce150a9c6667974d",
      "parityStatus": "approved"
    },
    {
      "legacyKey": "STRINGS.SOCIAL.LOG_STORY.ANNIVERSARY_MISSED_2",
      "targetKind": "body",
      "targetId": "chronicle.anniversary-missed.baseline.002",
      "status": "migrated",
      "legacyParityHash": "sha256:1ccb7634a5975e18e5e11e6627fb581c98b0c9ec6cafb58774f732d27c54e81a",
      "targetParityHash": "sha256:32f70878ee610875ddb670a07b258f9a46703fdac6915015823c3e5d319fa39d",
      "parityStatus": "approved"
    },
    {
      "legacyKey": "STRINGS.SOCIAL.LOG_STORY.ANNIVERSARY_MISSED_3",
      "targetKind": "body",
      "targetId": "chronicle.anniversary-missed.baseline.003",
      "status": "migrated",
      "legacyParityHash": "sha256:5c5a86a88dae5c5cacc36ba4030a892a34d038067c0e018e6721e7443294a4b4",
      "targetParityHash": "sha256:4d6ad5f5fefb62ee7ff053f28892634d06e7feb19a8893a7e888386eb0fea0a3",
      "parityStatus": "approved"
    },
    {
      "legacyKey": "STRINGS.SOCIAL.LOG_STORY.ANNIVERSARY_MISSED_4",
      "targetKind": "body",
      "targetId": "chronicle.anniversary-missed.baseline.004",
      "status": "migrated",
      "legacyParityHash": "sha256:99cae1051c514fe0f43d1a997739161c15b2c2fb57acce80612dd9387461b85c",
      "targetParityHash": "sha256:7262dd14b4d7a6d4a81c179f0e47df79f4e022f8046c4afa7ffe8e4ff8854dd8",
      "parityStatus": "approved"
    },
    {
      "legacyKey": "STRINGS.SOCIAL.LOG_STORY.APOLOGY_1",
      "targetKind": "body",
      "targetId": "chronicle.apology.baseline.001",
      "status": "migrated",
      "legacyParityHash": "sha256:167481eaa17b30a137a80facfc9517662d33b6f49f527b347ebde06ce9787cd2",
      "targetParityHash": "sha256:43cc3bc949c140ed629655a6356daeee18e9609a6c90b3b9c4b5701bec2fea7f",
      "parityStatus": "approved"
    },
    {
      "legacyKey": "STRINGS.SOCIAL.LOG_STORY.APOLOGY_2",
      "targetKind": "body",
      "targetId": "chronicle.apology.baseline.002",
      "status": "migrated",
      "legacyParityHash": "sha256:a866b43bf05a4f8ec737f7622947bd0194a122365ff0cd9066aee018fa09540f",
      "targetParityHash": "sha256:e4e71df9c670828027ebf8b49800d279e88e56f0506223763a81a07fd899e62d",
      "parityStatus": "approved"
    },
    {
      "legacyKey": "STRINGS.SOCIAL.LOG_STORY.APOLOGY_3",
      "targetKind": "body",
      "targetId": "chronicle.apology.baseline.003",
      "status": "migrated",
      "legacyParityHash": "sha256:d5a5938c8a778dd8eda4670b631ea64b03536b0677fa9c9c91a1954cbb162127",
      "targetParityHash": "sha256:773ac3293f883053963997c7147e4a8f676182785fe6e9f5f5ca9f797a4cc73d",
      "parityStatus": "approved"
    },
    {
      "legacyKey": "STRINGS.SOCIAL.LOG_STORY.APOLOGY_4",
      "targetKind": "body",
      "targetId": "chronicle.apology.baseline.004",
      "status": "migrated",
      "legacyParityHash": "sha256:a0defc606c4a1f21f317782f9246555d71bc659d6010f05d306b3ce878fbab68",
      "targetParityHash": "sha256:32a8e3b1fd726f786fe89db4a533524f48714de5a2a1de212987ec0d9db82480",
      "parityStatus": "approved"
    },
    {
      "legacyKey": "STRINGS.SOCIAL.LOG_STORY.APOLOGY_5",
      "targetKind": "body",
      "targetId": "chronicle.apology.baseline.005",
      "status": "migrated",
      "legacyParityHash": "sha256:79dd2a67f986404b5bc1e72d4bc993015fc14d6af86c33be262267586977d50b",
      "targetParityHash": "sha256:3ae12484a513b0e12c17148caf341e6b11badbb8d0f89d33a184f6b0ee77d344",
      "parityStatus": "approved"
    },
    {
      "legacyKey": "STRINGS.SOCIAL.LOG_STORY.APOLOGY_BOND_1",
      "targetKind": "body",
      "targetId": "chronicle.apology-bond.baseline.001",
      "status": "migrated",
      "legacyParityHash": "sha256:34bdf2942afbffebbb15f12b8eb7290e7a0680058fed1c65ee6d5585f50aefbf",
      "targetParityHash": "sha256:517ab88245c8d79a6efde7611edd3f6846243b256257ff8cf48d438d43f10bc0",
      "parityStatus": "approved"
    },
    {
      "legacyKey": "STRINGS.SOCIAL.LOG_STORY.APOLOGY_BOND_2",
      "targetKind": "body",
      "targetId": "chronicle.apology-bond.baseline.002",
      "status": "migrated",
      "legacyParityHash": "sha256:87d592592ed83af3b8ebb76365187dd1cf627db7a0c194ac71a3ca52331c13db",
      "targetParityHash": "sha256:bef91b2e56d71e4043d0b1ac8753c88994ae7f0122ace66505d4b0e63c30a5e8",
      "parityStatus": "approved"
    },
    {
      "legacyKey": "STRINGS.SOCIAL.LOG_STORY.APOLOGY_BOND_3",
      "targetKind": "body",
      "targetId": "chronicle.apology-bond.baseline.003",
      "status": "migrated",
      "legacyParityHash": "sha256:a38b10c0d75cc3082927d9644c867f1e1f4e406331741387beaa2ccf8f694d22",
      "targetParityHash": "sha256:4f3f0d81deb0eddd20ba4e1ca71fc3deb1e3941046b63358f8eb5ec96076960e",
      "parityStatus": "approved"
    },
    {
      "legacyKey": "STRINGS.SOCIAL.LOG_STORY.APOLOGY_BOND_4",
      "targetKind": "body",
      "targetId": "chronicle.apology-bond.baseline.004",
      "status": "migrated",
      "legacyParityHash": "sha256:1ec88b95e54017027c51d0d6f0266d9073ebbd70ca9db4c79e36b32d4d3765f4",
      "targetParityHash": "sha256:45f1b40172de628875e9a8028b9e5ba9ed9718af32ad3a261a6266a0e04c98bf",
      "parityStatus": "approved"
    },
    {
      "legacyKey": "STRINGS.SOCIAL.LOG_STORY.ARGUMENT_1",
      "targetKind": "body",
      "targetId": "chronicle.argument.baseline.001",
      "status": "migrated",
      "legacyParityHash": "sha256:f08bf5213df0c6c8e9c654c51fed14dd741bbc25ee916f3c7858d1e1f5817260",
      "targetParityHash": "sha256:e6c47e8dd6afe10f39f109d78ce8f92ffb8c36c0070215b2e33c3cc9338ef6da",
      "parityStatus": "approved"
    },
    {
      "legacyKey": "STRINGS.SOCIAL.LOG_STORY.ARGUMENT_2",
      "targetKind": "body",
      "targetId": "chronicle.argument.baseline.002",
      "status": "migrated",
      "legacyParityHash": "sha256:c61274b0294d0adfa9de54e58b07926a2f753547e01bdddd47d15f362fd2f1b8",
      "targetParityHash": "sha256:d98c63b5401abd0c1ecda1e0f968a611fedd4985eb6d0c15c6d88ad37cb93b63",
      "parityStatus": "approved"
    },
    {
      "legacyKey": "STRINGS.SOCIAL.LOG_STORY.ARGUMENT_3",
      "targetKind": "body",
      "targetId": "chronicle.argument.baseline.003",
      "status": "migrated",
      "legacyParityHash": "sha256:1ecb0aff83b320a94a697d1eb25c141d187b294af2fe5c8e6fc34f81282ef013",
      "targetParityHash": "sha256:b3c63f09fdbdef1b7346c95061b89f7e70de3c669e1920c99c8c636624a8707f",
      "parityStatus": "approved"
    },
    {
      "legacyKey": "STRINGS.SOCIAL.LOG_STORY.ARGUMENT_4",
      "targetKind": "body",
      "targetId": "chronicle.argument.baseline.004",
      "status": "migrated",
      "legacyParityHash": "sha256:d910713f9a7bfa08730bdb1dabeb9bf2050ebc5c643532b742da081fcb171ccb",
      "targetParityHash": "sha256:48b07f5634ec2a1cd18c579c17d54404345c547526ebe7ba69fa141fc4709f71",
      "parityStatus": "approved"
    },
    {
      "legacyKey": "STRINGS.SOCIAL.LOG_STORY.ARGUMENT_5",
      "targetKind": "body",
      "targetId": "chronicle.argument.baseline.005",
      "status": "migrated",
      "legacyParityHash": "sha256:f2ac39d2bffbff9d95c862165a628d672f22b68adb692a45069cf0c74c417426",
      "targetParityHash": "sha256:9bdc49e728e7aed4291ce4a89f6ebe3b324dd3f97d699629e3ea0f776b792db1",
      "parityStatus": "approved"
    },
    {
      "legacyKey": "STRINGS.SOCIAL.LOG_STORY.ARGUMENT_CAUSE_1",
      "targetKind": "body",
      "targetId": "chronicle.argument.with-cause.001",
      "status": "migrated",
      "legacyParityHash": "sha256:8283fb71c0c7df25b5bdb4c6fb2bd60951bdfe6f8fe0ed0d3d291395ddf11345",
      "targetParityHash": "sha256:d6589a49da0f750b48b6008489402010ad9ff43109040c53e92a7ffac06d78c9",
      "parityStatus": "approved"
    },
    {
      "legacyKey": "STRINGS.SOCIAL.LOG_STORY.BESTFRIEND_1",
      "targetKind": "body",
      "targetId": "chronicle.bestfriend.baseline.001",
      "status": "migrated",